{"actor_id":"pilot.operator","actor_role":"operator","command_id":"cmd-61a288fe-25c7-4227-bee8-a47d889fc2b1","event_id":"evt-b9af1796-754f-4472-be83-dd1681cb3cf5","expected_revision":8,"narrative_sha256":"232ee2f77e4508ba74cff8c094065dd35f354a0203a8994f3c23be555e479f05","occurred_at":"2026-10-14T04:33:20Z","passport_sha256":"71dc19a33c8cfa2619d59cac39d117e709fe7ae513ad449e0457251198be99bb","run_id":"run-b0667dc7-4f37-4151-bce4-5ed608fdefc5","schema_version":"1.0.0"}
