{"actor_id":"pilot.operator","actor_role":"operator","command_id":"cmd-bb1545f8-eb9c-4a9b-9412-b5c693a1e5e9","event_id":"evt-79347430-0a8e-4af7-98c4-7d77710654bd","expected_revision":4,"narrative_sha256":"ddf74fbb2f6473f4f7c8ec257d955a6ab51ac00256099427ba1f3467037ec2e5","occurred_at":"2026-10-14T04:33:11Z","passport_sha256":"9870cfd5442277ca3dce5db98f8c36e33b8317880a6ac82ef7f3c94828b768ee","run_id":"run-f3e090cf-5302-4b22-b91b-fb5c36813b4f","schema_version":"1.0.0"}
