{"actor_id":"pilot.operator","actor_role":"operator","command_id":"cmd-fe36b11b-823a-4a64-93c8-4fc87ca6be03","event_id":"evt-75640b8e-507f-4e97-a68f-e1ec0ea44351","expected_revision":8,"narrative_sha256":"ddf74fbb2f6473f4f7c8ec257d955a6ab51ac00256099427ba1f3467037ec2e5","occurred_at":"2026-10-14T04:33:13Z","passport_sha256":"7576e99cbbbf9db6bd2b9819a99d824604bc04690f55417c0836c60dd9e2e1e6","run_id":"run-f3e090cf-5302-4b22-b91b-fb5c36813b4f","schema_version":"1.0.0"}
